{
 "id": "listing.link-list",
 "title": "Link list",
 "semantic": {
  "id": "listing.link-list",
  "category": "LISTING"
 },
 "source": {
  "id": "component:ResourcesIndex:ri-list",
  "file": "src/pages/company/ResourcesIndex.jsx",
  "tag": "section",
  "lines": "17-29",
  "tagLine": 17,
  "anchor": "ri-list",
  "anchorLine": 17
 },
 "purpose": "Heading + intro beside a list of linked items (title, short description), legal and resource variants.",
 "retrievalEligible": true,
 "placement": "main",
 "variants": {
  "default": {
   "description": "variant 'default'",
   "requiredFields": [
    "heading",
    "items",
    "lead"
   ],
   "forbiddenFields": [],
   "observedOnRoutes": 1,
   "observedOn": [
    "/resources/"
   ],
   "contentSampled": true
  },
  "legal": {
   "description": "variant 'legal'",
   "requiredFields": [
    "heading",
    "items"
   ],
   "forbiddenFields": [
    "lead"
   ],
   "observedOnRoutes": 1,
   "observedOn": [
    "/legal/"
   ],
   "contentSampled": true
  }
 },
 "content": {
  "budgetRule": "maxWords/maxChars = the maximum observed for the field across every reference example (schema/examples/reference/*, extracted from the rendered clone); list sizes = observed min/max. Never exceed; shorter is allowed. Long-form text in the clone is placeholder copy of the original's length.",
  "requiredFields": [
   "heading",
   "items"
  ],
  "fields": {
   "heading": {
    "type": "text",
    "maxWords": 3,
    "maxChars": 16,
    "observedIn": 5
   },
   "items[].href": {
    "type": "link",
    "observedIn": 61
   },
   "items[].text": {
    "type": "text",
    "maxWords": 89,
    "maxChars": 592,
    "observedIn": 42
   },
   "items[].title": {
    "type": "text",
    "maxWords": 23,
    "maxChars": 151,
    "observedIn": 61
   },
   "lead": {
    "type": "text",
    "maxWords": 36,
    "maxChars": 232,
    "observedIn": 3
   }
  },
  "listSizes": {
   "items": [
    5,
    18
   ]
  },
  "itemRequiredFields": [
   "href",
   "title"
  ],
  "bodyBlockKinds": []
 },
 "assets": {
  "fields": {},
  "note": "reference mode may use referenceRoles; generated mode must use generatedRoles (generation-safe only). See assets/asset-roles.json."
 },
 "generatedAssetRoles": [],
 "style": {
  "props": {
   "spaceBefore": {
    "kind": "token",
    "allowed": [
     "space.section.hero",
     "space.section.s200"
    ]
   }
  },
  "note": "token props take token-catalog paths only (tokens/llm/token-catalog.json); allowed values = values observed in the reference examples (tokens/llm/token-policy.json styleProps)."
 },
 "constraints": {
  "maxPerPage": 3,
  "consecutiveVariants": [
   "default",
   "legal"
  ]
 },
 "motion": {
  "allowedPatterns": [
   "static"
  ],
  "requiredPatterns": [],
  "reducedMotionFallback": {
   "static": "none-needed"
  },
  "note": "pattern evidence and reduced-motion fallbacks: tokens/00-foundation/motion-patterns.json"
 },
 "responsive": [
  {
   "range": ">1280",
   "behavior": "desktop layout as measured at 1440"
  },
  {
   "range": "800-1280",
   "behavior": "md tier: container padding 64, display type steps down, multi-column grids collapse to 1 or 2 columns"
  },
  {
   "range": "<=799",
   "behavior": "sm tier: container padding 16, single column, type at the sm preset"
  }
 ],
 "runtimeUi": [],
 "measuredHeightsPx": {
  "1440": {
   "routes": 2,
   "nodes": 5,
   "minPx": 494,
   "maxPx": 4247,
   "medianPx": 1381.3,
   "sample": {
    "/legal/": [
     1381.3,
     494
    ],
    "/resources/": [
     1321,
     3745,
     4247
    ]
   }
  }
 },
 "evidence": [
  "src/pages/company/ResourcesIndex.jsx:17-29",
  "specs/resources-index.md:1-30",
  "specs/legal-index.md:1-30"
 ]
}
