{
 "id": "social-proof.testimonial-wall",
 "title": "Testimonial wall",
 "semantic": {
  "id": "social-proof.testimonial-wall",
  "category": "SOCIAL_PROOF"
 },
 "source": {
  "id": "component:CustomersIndex:cu-wall",
  "file": "src/pages/customers/CustomersIndex.jsx",
  "tag": "section",
  "lines": "200-212",
  "tagLine": 200,
  "anchor": "cu-wall",
  "anchorLine": 200
 },
 "purpose": "Masonry wall of short customer testimonials with a bottom fade.",
 "retrievalEligible": true,
 "placement": "main",
 "variants": {
  "default": {
   "description": "variant 'default'",
   "requiredFields": [
    "items",
    "quote"
   ],
   "forbiddenFields": [],
   "observedOnRoutes": 1,
   "observedOn": [
    "/customers/"
   ],
   "contentSampled": true
  }
 },
 "content": {
  "budgetRule": "maxWords/maxChars = the maximum observed for the field across every reference example (schema/examples/reference/*, extracted from the rendered clone); list sizes = observed min/max. Never exceed; shorter is allowed. Long-form text in the clone is placeholder copy of the original's length.",
  "requiredFields": [
   "items",
   "quote"
  ],
  "fields": {
   "items[].media.alt": {
    "type": "text",
    "maxWords": 1,
    "maxChars": 1,
    "observedIn": 7,
    "assetAlt": true
   },
   "items[].title": {
    "type": "text",
    "maxWords": 59,
    "maxChars": 400,
    "observedIn": 60
   },
   "quote.text": {
    "type": "text",
    "maxWords": 24,
    "maxChars": 169,
    "observedIn": 1
   }
  },
  "listSizes": {
   "items": [
    60,
    60
   ]
  },
  "itemRequiredFields": [
   "title"
  ],
  "bodyBlockKinds": []
 },
 "assets": {
  "fields": {
   "items[].media": {
    "type": "asset",
    "referenceRoles": [
     "person.photo",
     "photo.real-scene",
     "product.screenshot"
    ],
    "generatedRoles": [
     "person.fictional-avatar",
     "photo.generated-scene",
     "product.generated-visual"
    ]
   }
  },
  "note": "reference mode may use referenceRoles; generated mode must use generatedRoles (generation-safe only). See assets/asset-roles.json."
 },
 "generatedAssetRoles": [
  "person.fictional-avatar",
  "photo.generated-scene",
  "product.generated-visual"
 ],
 "style": {
  "props": {},
  "note": "token props take token-catalog paths only (tokens/llm/token-catalog.json); allowed values = values observed in the reference examples (tokens/llm/token-policy.json styleProps)."
 },
 "constraints": {
  "maxPerPage": 1,
  "consecutiveVariants": []
 },
 "motion": {
  "allowedPatterns": [
   "static"
  ],
  "requiredPatterns": [],
  "reducedMotionFallback": {
   "static": "none-needed"
  },
  "note": "pattern evidence and reduced-motion fallbacks: tokens/00-foundation/motion-patterns.json"
 },
 "responsive": [
  {
   "range": ">1280",
   "behavior": "desktop layout as measured at 1440"
  },
  {
   "range": "800-1280",
   "behavior": "md tier: container padding 64, display type steps down, multi-column grids collapse to 1 or 2 columns"
  },
  {
   "range": "<=799",
   "behavior": "sm tier: container padding 16, single column, type at the sm preset"
  }
 ],
 "runtimeUi": [],
 "measuredHeightsPx": {
  "1440": {
   "routes": 1,
   "nodes": 1,
   "minPx": 25816,
   "maxPx": 25816,
   "medianPx": 25816,
   "sample": {
    "/customers/": [
     25816
    ]
   }
  }
 },
 "evidence": [
  "src/pages/customers/CustomersIndex.jsx:200-212",
  "specs/customers-index.md:1-30"
 ]
}
