{
 "id": "article.lede",
 "title": "Article lede",
 "semantic": {
  "id": "article.lede",
  "category": "ARTICLE"
 },
 "source": {
  "id": "component:BlogPost:blog-post__lede",
  "file": "src/pages/blog/BlogPost.jsx",
  "tag": "p",
  "lines": "215-227",
  "tagLine": 215,
  "anchor": "blog-post__lede",
  "anchorLine": 215
 },
 "purpose": "Large lead paragraph opening a blog post.",
 "retrievalEligible": true,
 "placement": "main",
 "variants": {
  "default": {
   "description": "variant 'default'",
   "requiredFields": [
    "lead"
   ],
   "forbiddenFields": [],
   "observedOnRoutes": 196,
   "observedOn": [
    "/blog/2025-fall-launch/",
    "/blog/30-days-in/",
    "/blog/60-days-in/",
    "/blog/9-digital-twins-you-can-build-today/",
    "/blog/a-conversation-with-trellos-head-of-design/",
    "/blog/a-nuclear-meltdown-caused-by-design/",
    "/blog/accountable-ai/",
    "/blog/ai-generated-privacy-breaches/",
    "/blog/ai-powered-contextual-chat/",
    "/blog/alloy/",
    "/blog/avoiding-the-moral-crumple-zone/",
    "/blog/bad-data-decision/"
   ],
   "contentSampled": true
  }
 },
 "content": {
  "budgetRule": "maxWords/maxChars = the maximum observed for the field across every reference example (schema/examples/reference/*, extracted from the rendered clone); list sizes = observed min/max. Never exceed; shorter is allowed. Long-form text in the clone is placeholder copy of the original's length.",
  "requiredFields": [
   "lead"
  ],
  "fields": {
   "lead": {
    "type": "text",
    "maxWords": 67,
    "maxChars": 410,
    "observedIn": 3
   }
  },
  "listSizes": {},
  "itemRequiredFields": [],
  "bodyBlockKinds": []
 },
 "assets": {
  "fields": {},
  "note": "reference mode may use referenceRoles; generated mode must use generatedRoles (generation-safe only). See assets/asset-roles.json."
 },
 "generatedAssetRoles": [],
 "style": {
  "props": {
   "spaceBefore": {
    "kind": "token",
    "allowed": [
     "space.section.s200"
    ]
   }
  },
  "note": "token props take token-catalog paths only (tokens/llm/token-catalog.json); allowed values = values observed in the reference examples (tokens/llm/token-policy.json styleProps)."
 },
 "constraints": {
  "maxPerPage": 1,
  "consecutiveVariants": []
 },
 "motion": {
  "allowedPatterns": [
   "static"
  ],
  "requiredPatterns": [],
  "reducedMotionFallback": {
   "static": "none-needed"
  },
  "note": "pattern evidence and reduced-motion fallbacks: tokens/00-foundation/motion-patterns.json"
 },
 "responsive": [
  {
   "range": ">1280",
   "behavior": "desktop layout as measured at 1440"
  },
  {
   "range": "800-1280",
   "behavior": "md tier: container padding 64, display type steps down, multi-column grids collapse to 1 or 2 columns"
  },
  {
   "range": "<=799",
   "behavior": "sm tier: container padding 16, single column, type at the sm preset"
  }
 ],
 "runtimeUi": [],
 "measuredHeightsPx": {
  "1440": {
   "routes": 196,
   "nodes": 196,
   "minPx": 144,
   "maxPx": 480,
   "medianPx": 240.0,
   "sample": {
    "/blog/2025-fall-launch/": [
     240
    ],
    "/blog/30-days-in/": [
     240
    ],
    "/blog/60-days-in/": [
     240
    ],
    "/blog/9-digital-twins-you-can-build-today/": [
     192
    ],
    "/blog/a-conversation-with-trellos-head-of-design/": [
     240
    ]
   }
  }
 },
 "evidence": [
  "src/pages/blog/BlogPost.jsx:215-227",
  "specs/blog-post.md:1-30"
 ]
}
