{
 "id": "listing.event-cards",
 "title": "Event cards",
 "semantic": {
  "id": "listing.event-cards",
  "category": "LISTING"
 },
 "source": {
  "id": "component:EventCard:co-event",
  "file": "src/components/company/EventCard.jsx",
  "tag": "a",
  "lines": "19-22",
  "tagLine": 19,
  "anchor": "co-event",
  "anchorLine": 19
 },
 "purpose": "Row of event cards (image, title, date/location meta), optionally under a heading.",
 "retrievalEligible": true,
 "placement": "main",
 "variants": {
  "default": {
   "description": "variant 'default'",
   "requiredFields": [
    "items"
   ],
   "forbiddenFields": [],
   "observedOnRoutes": 2,
   "observedOn": [
    "/events/",
    "/webinars/"
   ],
   "contentSampled": true
  },
  "more-events": {
   "description": "variant 'more-events'",
   "requiredFields": [
    "items"
   ],
   "forbiddenFields": [],
   "observedOnRoutes": 46,
   "observedOn": [
    "/events/a-balancing-act-mastering-customer-feedback/",
    "/events/a-chat-with-jon-alferness/",
    "/events/ai-powered-ux-process-how-ai-is-transforming-the-design-process/",
    "/events/channels-by-dovetail-a-deep-dive-into-automating-your-feedback-workflows/",
    "/events/config-watch-party-sydney/",
    "/events/cursor-curated-sydney/",
    "/events/data-driven-design-mastering-user-research/",
    "/events/dig-deeper-level-up-your-a-b-testing-to-build-better-products/",
    "/events/dovetail-for-designers-webinar/",
    "/events/dovetail-for-product-managers-webinar/",
    "/events/dovetail-for-researchers-webinar/",
    "/events/forrester-cx-summit-north-america/"
   ],
   "contentSampled": true
  }
 },
 "content": {
  "budgetRule": "maxWords/maxChars = the maximum observed for the field across every reference example (schema/examples/reference/*, extracted from the rendered clone); list sizes = observed min/max. Never exceed; shorter is allowed. Long-form text in the clone is placeholder copy of the original's length.",
  "requiredFields": [
   "items"
  ],
  "fields": {
   "items[].href": {
    "type": "link",
    "observedIn": 5
   },
   "items[].media.alt": {
    "type": "text",
    "maxWords": 1,
    "maxChars": 1,
    "observedIn": 5,
    "assetAlt": true
   },
   "items[].text": {
    "type": "text",
    "maxWords": 4,
    "maxChars": 18,
    "observedIn": 5
   },
   "items[].title": {
    "type": "text",
    "maxWords": 11,
    "maxChars": 77,
    "observedIn": 5
   }
  },
  "listSizes": {
   "items": [
    1,
    2
   ]
  },
  "itemRequiredFields": [
   "href",
   "media",
   "text",
   "title"
  ],
  "bodyBlockKinds": []
 },
 "assets": {
  "fields": {
   "items[].media": {
    "type": "asset",
    "referenceRoles": [
     "product.screenshot"
    ],
    "generatedRoles": [
     "product.generated-visual"
    ]
   }
  },
  "note": "reference mode may use referenceRoles; generated mode must use generatedRoles (generation-safe only). See assets/asset-roles.json."
 },
 "generatedAssetRoles": [
  "product.generated-visual"
 ],
 "style": {
  "props": {
   "spaceBefore": {
    "kind": "token",
    "allowed": [
     "space.section.s200"
    ]
   }
  },
  "note": "token props take token-catalog paths only (tokens/llm/token-catalog.json); allowed values = values observed in the reference examples (tokens/llm/token-policy.json styleProps)."
 },
 "constraints": {
  "maxPerPage": 1,
  "consecutiveVariants": []
 },
 "motion": {
  "allowedPatterns": [
   "static"
  ],
  "requiredPatterns": [],
  "reducedMotionFallback": {
   "static": "none-needed"
  },
  "note": "pattern evidence and reduced-motion fallbacks: tokens/00-foundation/motion-patterns.json"
 },
 "responsive": [
  {
   "range": ">1280",
   "behavior": "desktop layout as measured at 1440"
  },
  {
   "range": "800-1280",
   "behavior": "md tier: container padding 64, display type steps down, multi-column grids collapse to 1 or 2 columns"
  },
  {
   "range": "<=799",
   "behavior": "sm tier: container padding 16, single column, type at the sm preset"
  }
 ],
 "runtimeUi": [],
 "measuredHeightsPx": {
  "1440": {
   "routes": 50,
   "nodes": 50,
   "minPx": 383.6,
   "maxPx": 503.6,
   "medianPx": 503.6,
   "sample": {
    "/events/": [
     383.6
    ],
    "/events/a-balancing-act-mastering-customer-feedback/": [
     503.6
    ],
    "/events/a-chat-with-jon-alferness/": [
     503.6
    ],
    "/events/ai-powered-ux-process-how-ai-is-transforming-the-design-process/": [
     503.6
    ],
    "/events/channels-by-dovetail-a-deep-dive-into-automating-your-feedback-workflows/": [
     503.6
    ]
   }
  }
 },
 "evidence": [
  "src/components/company/EventCard.jsx:19-22",
  "specs/events-index.md:1-30",
  "specs/event-detail.md:1-30"
 ]
}
