{
 "id": "listing.resource-cards",
 "title": "Resource cards",
 "semantic": {
  "id": "listing.resource-cards",
  "category": "LISTING"
 },
 "source": {
  "id": "component:Enterprise:en-res",
  "file": "src/pages/corporate/Enterprise.jsx",
  "tag": "div",
  "lines": "359-371",
  "tagLine": 359,
  "anchor": "en-res",
  "anchorLine": 359
 },
 "purpose": "Heading block and a row of resource cards.",
 "retrievalEligible": true,
 "placement": "main",
 "variants": {
  "default": {
   "description": "variant 'default'",
   "requiredFields": [
    "actions",
    "heading",
    "lead",
    "media"
   ],
   "forbiddenFields": [],
   "observedOnRoutes": 1,
   "observedOn": [
    "/enterprise/"
   ],
   "contentSampled": true
  }
 },
 "content": {
  "budgetRule": "maxWords/maxChars = the maximum observed for the field across every reference example (schema/examples/reference/*, extracted from the rendered clone); list sizes = observed min/max. Never exceed; shorter is allowed. Long-form text in the clone is placeholder copy of the original's length.",
  "requiredFields": [
   "actions",
   "heading",
   "lead",
   "media"
  ],
  "fields": {
   "actions[].href": {
    "type": "link",
    "observedIn": 6
   },
   "actions[].label": {
    "type": "text",
    "maxWords": 3,
    "maxChars": 26,
    "observedIn": 6
   },
   "heading": {
    "type": "text",
    "maxWords": 3,
    "maxChars": 24,
    "observedIn": 1
   },
   "lead": {
    "type": "text",
    "maxWords": 9,
    "maxChars": 61,
    "observedIn": 1
   },
   "media[].alt": {
    "type": "text",
    "maxWords": 1,
    "maxChars": 1,
    "observedIn": 3,
    "assetAlt": true
   }
  },
  "listSizes": {
   "actions": [
    6,
    6
   ],
   "media": [
    3,
    3
   ]
  },
  "itemRequiredFields": [],
  "bodyBlockKinds": []
 },
 "assets": {
  "fields": {
   "media[]": {
    "type": "asset",
    "referenceRoles": [
     "illustration.brand"
    ],
    "generatedRoles": [
     "illustration.generated"
    ]
   }
  },
  "note": "reference mode may use referenceRoles; generated mode must use generatedRoles (generation-safe only). See assets/asset-roles.json."
 },
 "generatedAssetRoles": [
  "illustration.generated"
 ],
 "style": {
  "props": {},
  "note": "token props take token-catalog paths only (tokens/llm/token-catalog.json); allowed values = values observed in the reference examples (tokens/llm/token-policy.json styleProps)."
 },
 "constraints": {
  "maxPerPage": 1,
  "consecutiveVariants": []
 },
 "motion": {
  "allowedPatterns": [
   "pixel.band-scrub"
  ],
  "requiredPatterns": [
   "pixel.band-scrub"
  ],
  "reducedMotionFallback": {
   "pixel.band-scrub": "unchanged"
  },
  "note": "pattern evidence and reduced-motion fallbacks: tokens/00-foundation/motion-patterns.json"
 },
 "responsive": [
  {
   "range": ">1280",
   "behavior": "desktop layout as measured at 1440"
  },
  {
   "range": "800-1280",
   "behavior": "md tier: container padding 64, display type steps down, multi-column grids collapse to 1 or 2 columns"
  },
  {
   "range": "<=799",
   "behavior": "sm tier: container padding 16, single column, type at the sm preset"
  }
 ],
 "runtimeUi": [],
 "measuredHeightsPx": {
  "1440": {
   "routes": 1,
   "nodes": 1,
   "minPx": 645,
   "maxPx": 645,
   "medianPx": 645,
   "sample": {
    "/enterprise/": [
     645
    ]
   }
  }
 },
 "evidence": [
  "src/pages/corporate/Enterprise.jsx:359-371",
  "specs/enterprise.md:1-40"
 ]
}
