{
 "id": "content.campaign-text",
 "title": "Campaign statement",
 "semantic": {
  "id": "content.campaign-text",
  "category": "CONTENT"
 },
 "source": {
  "id": "component:BestNeverGuessPage:bng-text",
  "file": "src/pages/campaigns/bng/BestNeverGuessPage.jsx",
  "tag": "section",
  "lines": "117-129",
  "tagLine": 117,
  "anchor": "bng-text",
  "anchorLine": 117
 },
 "purpose": "Large campaign paragraph on the blue campaign theme.",
 "retrievalEligible": true,
 "placement": "main",
 "variants": {
  "default": {
   "description": "variant 'default'",
   "requiredFields": [
    "actions",
    "heading",
    "media"
   ],
   "forbiddenFields": [],
   "observedOnRoutes": 2,
   "observedOn": [
    "/aws-summit-sydney-2026/",
    "/the-best-never-guess/"
   ],
   "contentSampled": true
  }
 },
 "content": {
  "budgetRule": "maxWords/maxChars = the maximum observed for the field across every reference example (schema/examples/reference/*, extracted from the rendered clone); list sizes = observed min/max. Never exceed; shorter is allowed. Long-form text in the clone is placeholder copy of the original's length.",
  "requiredFields": [
   "actions",
   "heading",
   "media"
  ],
  "fields": {
   "actions[].href": {
    "type": "link",
    "observedIn": 2
   },
   "actions[].label": {
    "type": "text",
    "maxWords": 5,
    "maxChars": 23,
    "observedIn": 2
   },
   "heading": {
    "type": "text",
    "maxWords": 48,
    "maxChars": 300,
    "observedIn": 2
   },
   "media[].alt": {
    "type": "text",
    "maxWords": 1,
    "maxChars": 1,
    "observedIn": 22,
    "assetAlt": true
   }
  },
  "listSizes": {
   "actions": [
    1,
    1
   ],
   "media": [
    11,
    11
   ]
  },
  "itemRequiredFields": [],
  "bodyBlockKinds": []
 },
 "assets": {
  "fields": {
   "media[]": {
    "type": "asset",
    "referenceRoles": [
     "illustration.brand"
    ],
    "generatedRoles": [
     "illustration.generated"
    ]
   }
  },
  "note": "reference mode may use referenceRoles; generated mode must use generatedRoles (generation-safe only). See assets/asset-roles.json."
 },
 "generatedAssetRoles": [
  "illustration.generated"
 ],
 "style": {
  "props": {},
  "note": "token props take token-catalog paths only (tokens/llm/token-catalog.json); allowed values = values observed in the reference examples (tokens/llm/token-policy.json styleProps)."
 },
 "constraints": {
  "maxPerPage": 1,
  "consecutiveVariants": []
 },
 "motion": {
  "allowedPatterns": [
   "static"
  ],
  "requiredPatterns": [],
  "reducedMotionFallback": {
   "static": "none-needed"
  },
  "note": "pattern evidence and reduced-motion fallbacks: tokens/00-foundation/motion-patterns.json"
 },
 "responsive": [
  {
   "range": ">1280",
   "behavior": "desktop layout as measured at 1440"
  },
  {
   "range": "800-1280",
   "behavior": "md tier: container padding 64, display type steps down, multi-column grids collapse to 1 or 2 columns"
  },
  {
   "range": "<=799",
   "behavior": "sm tier: container padding 16, single column, type at the sm preset"
  }
 ],
 "runtimeUi": [],
 "measuredHeightsPx": {
  "1440": {
   "routes": 2,
   "nodes": 2,
   "minPx": 462,
   "maxPx": 462,
   "medianPx": 462.0,
   "sample": {
    "/aws-summit-sydney-2026/": [
     462
    ],
    "/the-best-never-guess/": [
     462
    ]
   }
  }
 },
 "evidence": [
  "src/pages/campaigns/bng/BestNeverGuessPage.jsx:117-129",
  "specs/best-never-guess.md:1-30",
  "specs/campaign-aws-summit.md:1-30"
 ]
}
