{
 "id": "hero.quiz-hub",
 "title": "Quiz hub opener",
 "semantic": {
  "id": "hero.quiz-hub",
  "category": "HERO"
 },
 "source": {
  "id": "component:QuizHub:qh",
  "file": "src/pages/tools/QuizHub.jsx",
  "tag": "section",
  "lines": "14-26",
  "tagLine": 14,
  "anchor": "qh",
  "anchorLine": 14
 },
 "purpose": "Centred eyebrow + H48 + lead followed by the three quiz entry cards.",
 "retrievalEligible": true,
 "placement": "main",
 "variants": {
  "default": {
   "description": "variant 'default'",
   "requiredFields": [
    "heading",
    "items",
    "lead"
   ],
   "forbiddenFields": [],
   "observedOnRoutes": 1,
   "observedOn": [
    "/quiz/"
   ],
   "contentSampled": true
  }
 },
 "content": {
  "budgetRule": "maxWords/maxChars = the maximum observed for the field across every reference example (schema/examples/reference/*, extracted from the rendered clone); list sizes = observed min/max. Never exceed; shorter is allowed. Long-form text in the clone is placeholder copy of the original's length.",
  "requiredFields": [
   "heading",
   "items",
   "lead"
  ],
  "fields": {
   "heading": {
    "type": "text",
    "maxWords": 5,
    "maxChars": 33,
    "observedIn": 1
   },
   "items[].href": {
    "type": "link",
    "observedIn": 3
   },
   "items[].text": {
    "type": "text",
    "maxWords": 20,
    "maxChars": 105,
    "observedIn": 3
   },
   "items[].title": {
    "type": "text",
    "maxWords": 5,
    "maxChars": 33,
    "observedIn": 3
   },
   "lead": {
    "type": "text",
    "maxWords": 22,
    "maxChars": 106,
    "observedIn": 1
   }
  },
  "listSizes": {
   "items": [
    3,
    3
   ]
  },
  "itemRequiredFields": [
   "href",
   "text",
   "title"
  ],
  "bodyBlockKinds": []
 },
 "assets": {
  "fields": {},
  "note": "reference mode may use referenceRoles; generated mode must use generatedRoles (generation-safe only). See assets/asset-roles.json."
 },
 "generatedAssetRoles": [],
 "style": {
  "props": {},
  "note": "token props take token-catalog paths only (tokens/llm/token-catalog.json); allowed values = values observed in the reference examples (tokens/llm/token-policy.json styleProps)."
 },
 "constraints": {
  "maxPerPage": 1,
  "consecutiveVariants": []
 },
 "motion": {
  "allowedPatterns": [
   "static"
  ],
  "requiredPatterns": [],
  "reducedMotionFallback": {
   "static": "none-needed"
  },
  "note": "pattern evidence and reduced-motion fallbacks: tokens/00-foundation/motion-patterns.json"
 },
 "responsive": [
  {
   "range": ">1280",
   "behavior": "desktop layout as measured at 1440"
  },
  {
   "range": "800-1280",
   "behavior": "md tier: container padding 64, display type steps down, multi-column grids collapse to 1 or 2 columns"
  },
  {
   "range": "<=799",
   "behavior": "sm tier: container padding 16, single column, type at the sm preset"
  }
 ],
 "runtimeUi": [],
 "measuredHeightsPx": {
  "1440": {
   "routes": 1,
   "nodes": 1,
   "minPx": 593,
   "maxPx": 593,
   "medianPx": 593,
   "sample": {
    "/quiz/": [
     593
    ]
   }
  }
 },
 "evidence": [
  "src/pages/tools/QuizHub.jsx:14-26",
  "specs/quiz.md:1-30"
 ]
}
