{
 "id": "hero.split-media",
 "title": "Split hero with media",
 "semantic": {
  "id": "hero.split-media",
  "category": "HERO"
 },
 "source": {
  "id": "component:Enterprise:en-hero__text",
  "file": "src/pages/corporate/Enterprise.jsx",
  "tag": "div",
  "lines": "27-39",
  "tagLine": 27,
  "anchor": "en-hero__text",
  "anchorLine": 27
 },
 "purpose": "Heading block (eyebrow, H64/H80, lead, CTA row) beside a large product image; enterprise and deploy variants.",
 "retrievalEligible": true,
 "placement": "main",
 "variants": {
  "deploy": {
   "description": "variant 'deploy'",
   "requiredFields": [
    "actions",
    "heading",
    "lead",
    "media"
   ],
   "forbiddenFields": [],
   "observedOnRoutes": 1,
   "observedOn": [
    "/deploy/"
   ],
   "contentSampled": true
  },
  "enterprise": {
   "description": "variant 'enterprise'",
   "requiredFields": [
    "actions",
    "heading",
    "lead",
    "media"
   ],
   "forbiddenFields": [],
   "observedOnRoutes": 1,
   "observedOn": [
    "/enterprise/"
   ],
   "contentSampled": true
  }
 },
 "content": {
  "budgetRule": "maxWords/maxChars = the maximum observed for the field across every reference example (schema/examples/reference/*, extracted from the rendered clone); list sizes = observed min/max. Never exceed; shorter is allowed. Long-form text in the clone is placeholder copy of the original's length.",
  "requiredFields": [
   "actions",
   "heading",
   "lead",
   "media"
  ],
  "fields": {
   "actions[].href": {
    "type": "link",
    "observedIn": 3
   },
   "actions[].label": {
    "type": "text",
    "maxWords": 4,
    "maxChars": 19,
    "observedIn": 3
   },
   "heading": {
    "type": "text",
    "maxWords": 7,
    "maxChars": 37,
    "observedIn": 2
   },
   "lead": {
    "type": "text",
    "maxWords": 37,
    "maxChars": 250,
    "observedIn": 2
   },
   "media[].alt": {
    "type": "text",
    "maxWords": 5,
    "maxChars": 34,
    "observedIn": 2,
    "assetAlt": true
   }
  },
  "listSizes": {
   "actions": [
    1,
    2
   ],
   "media": [
    1,
    1
   ]
  },
  "itemRequiredFields": [],
  "bodyBlockKinds": []
 },
 "assets": {
  "fields": {
   "media[]": {
    "type": "asset",
    "referenceRoles": [
     "product.screenshot"
    ],
    "generatedRoles": [
     "product.generated-visual"
    ]
   }
  },
  "note": "reference mode may use referenceRoles; generated mode must use generatedRoles (generation-safe only). See assets/asset-roles.json."
 },
 "generatedAssetRoles": [
  "product.generated-visual"
 ],
 "style": {
  "props": {
   "spaceBefore": {
    "kind": "token",
    "allowed": [
     "space.section.hero"
    ]
   }
  },
  "note": "token props take token-catalog paths only (tokens/llm/token-catalog.json); allowed values = values observed in the reference examples (tokens/llm/token-policy.json styleProps)."
 },
 "constraints": {
  "maxPerPage": 1,
  "consecutiveVariants": []
 },
 "motion": {
  "allowedPatterns": [
   "static"
  ],
  "requiredPatterns": [],
  "reducedMotionFallback": {
   "static": "none-needed"
  },
  "note": "pattern evidence and reduced-motion fallbacks: tokens/00-foundation/motion-patterns.json"
 },
 "responsive": [
  {
   "range": ">1280",
   "behavior": "desktop layout as measured at 1440"
  },
  {
   "range": "800-1280",
   "behavior": "md tier: container padding 64, display type steps down, multi-column grids collapse to 1 or 2 columns"
  },
  {
   "range": "<=799",
   "behavior": "sm tier: container padding 16, single column, type at the sm preset"
  }
 ],
 "runtimeUi": [],
 "measuredHeightsPx": {
  "1440": {
   "routes": 2,
   "nodes": 2,
   "minPx": 1089,
   "maxPx": 1149,
   "medianPx": 1119.0,
   "sample": {
    "/deploy/": [
     1149
    ],
    "/enterprise/": [
     1089
    ]
   }
  }
 },
 "evidence": [
  "src/pages/corporate/Enterprise.jsx:27-39",
  "specs/enterprise.md:1-40",
  "specs/deploy.md:1-40"
 ]
}
