{
 "id": "hero.template",
 "title": "Template landing hero",
 "semantic": {
  "id": "hero.template",
  "category": "HERO"
 },
 "source": {
  "id": "component:TemplateLanding:tl-hero",
  "file": "src/pages/tools/TemplateLanding.jsx",
  "tag": "div",
  "lines": "13-25",
  "tagLine": 13,
  "anchor": "tl-hero",
  "anchorLine": 13
 },
 "purpose": "Template download opener: eyebrow, H1, lead, CTA row and a large template preview with top/bottom fades.",
 "retrievalEligible": true,
 "placement": "main",
 "variants": {
  "default": {
   "description": "variant 'default'",
   "requiredFields": [
    "actions",
    "heading",
    "lead",
    "media"
   ],
   "forbiddenFields": [],
   "observedOnRoutes": 3,
   "observedOn": [
    "/research-report-template/",
    "/user-persona-template/",
    "/ux-research-plan-template/"
   ],
   "contentSampled": true
  }
 },
 "content": {
  "budgetRule": "maxWords/maxChars = the maximum observed for the field across every reference example (schema/examples/reference/*, extracted from the rendered clone); list sizes = observed min/max. Never exceed; shorter is allowed. Long-form text in the clone is placeholder copy of the original's length.",
  "requiredFields": [
   "actions",
   "heading",
   "lead",
   "media"
  ],
  "fields": {
   "actions[].href": {
    "type": "link",
    "observedIn": 6
   },
   "actions[].label": {
    "type": "text",
    "maxWords": 3,
    "maxChars": 17,
    "observedIn": 6
   },
   "heading": {
    "type": "text",
    "maxWords": 11,
    "maxChars": 54,
    "observedIn": 3
   },
   "lead": {
    "type": "text",
    "maxWords": 4,
    "maxChars": 25,
    "observedIn": 3
   },
   "media[].alt": {
    "type": "text",
    "maxWords": 14,
    "maxChars": 92,
    "observedIn": 3,
    "assetAlt": true
   }
  },
  "listSizes": {
   "actions": [
    2,
    2
   ],
   "media": [
    1,
    1
   ]
  },
  "itemRequiredFields": [],
  "bodyBlockKinds": []
 },
 "assets": {
  "fields": {
   "media[]": {
    "type": "asset",
    "referenceRoles": [
     "photo.real-scene",
     "product.screenshot"
    ],
    "generatedRoles": [
     "photo.generated-scene",
     "product.generated-visual"
    ]
   }
  },
  "note": "reference mode may use referenceRoles; generated mode must use generatedRoles (generation-safe only). See assets/asset-roles.json."
 },
 "generatedAssetRoles": [
  "photo.generated-scene",
  "product.generated-visual"
 ],
 "style": {
  "props": {},
  "note": "token props take token-catalog paths only (tokens/llm/token-catalog.json); allowed values = values observed in the reference examples (tokens/llm/token-policy.json styleProps)."
 },
 "constraints": {
  "maxPerPage": 1,
  "consecutiveVariants": []
 },
 "motion": {
  "allowedPatterns": [
   "static"
  ],
  "requiredPatterns": [],
  "reducedMotionFallback": {
   "static": "none-needed"
  },
  "note": "pattern evidence and reduced-motion fallbacks: tokens/00-foundation/motion-patterns.json"
 },
 "responsive": [
  {
   "range": ">1280",
   "behavior": "desktop layout as measured at 1440"
  },
  {
   "range": "800-1280",
   "behavior": "md tier: container padding 64, display type steps down, multi-column grids collapse to 1 or 2 columns"
  },
  {
   "range": "<=799",
   "behavior": "sm tier: container padding 16, single column, type at the sm preset"
  }
 ],
 "runtimeUi": [],
 "measuredHeightsPx": {
  "1440": {
   "routes": 3,
   "nodes": 3,
   "minPx": 1356.6,
   "maxPx": 1732,
   "medianPx": 1611.2,
   "sample": {
    "/research-report-template/": [
     1356.6
    ],
    "/user-persona-template/": [
     1732
    ],
    "/ux-research-plan-template/": [
     1611.2
    ]
   }
  }
 },
 "evidence": [
  "src/pages/tools/TemplateLanding.jsx:13-25",
  "specs/template-landing.md:1-30"
 ]
}
